0,147,"that's enough, don't say anymore please"
0,119,speed up your talking please
0,147,can you end the task
0,117,are your real or artificial
0,148,i need to know how many days so far i've taken off
0,138,what is the area of a 20 x 20 room
0,124,thank you for answering that
0,83,i need an alarm set
0,37,when did i last get my car tuned up
0,118,i need you to skip this song and play the next one
0,125,i ran out of cherrios so add that to the list
0,48,let's go through my to do list items please
0,121,cant say
0,140,"when is the next holiday, please"
0,11,is there a name that you call me
0,145,where should i go out for food to
0,39,can i get an uber for myself to the grocery store
0,38,what's the exchange rate between dollars and pesos
0,136,give me my location on the map
0,84,what is the tracking on my package
0,116,"what hotels are near, ny, ny for the 9th to 11th"
0,11,how do you usually refer to me
0,147,mute
0,3,what are the procedures for changing my oil
0,100,walk me through on how to roll over my 401k
0,53,remind me to do this in awhile
0,80,is there an update on flight dl123
0,88,is it possible to change to original settings
0,67,please cancel the reservation at zephers for joe and myself right now
0,101,has my time off request been approved yet
0,150,raise volume
0,3,do you know how to change car oil
0,119,speed up your speech
0,53,will you add a reminder for me
0,114,it was nice chatting with you
0,18,how can you schedule a meeting for me
0,117,are you a human or a bot
0,43,pull up my shopping list for me
0,113,i was on delta flight ab123 out of new york and haven't been able to locate my luggage
0,85,do i have reservations at creme at 7 pm
0,149,what do you recommend to do in vegas
0,22,what's the purpose of existence
0,7,i wanna know the interest rate on my bank of america cd account
0,83,set my alarm for 5pm
0,67,can you cancel my reservation for dinner tomorrow
0,17,how do i jump my car
0,38,what is the exchange rate between rubles and us dollars
0,3,how do i choose the correct oil and how do i change it
0,79,can you tell me when i'm supposed to get paid
0,76,please read my reminders
0,142,how does this do on gas mileage
0,99,how many years has al been on earth
0,128,is it safe to travel to russia
0,94,what amount do my state taxes look like
0,136,how will i find my current location
0,104,what steps are involved in making lasagna
0,38,how many dollars can i exchange for 200 pounds
0,43,i need to know the things on my shopping list
0,147,please stop
0,38,what's the currency conversion between rubles and dollars
0,117,i need to know if you are a real person or an ai
0,32,tell me when two minutes are up
0,99,how old are you siri
0,110,whats in my gas tank
0,92,roll a seven sided dice for me
0,21,what is the title of this tune
0,22,define the meaning of life
0,110,tell me how much gas i have
0,76,i need to know the content of my list of reminders
0,9,will they take reservations at torris
0,144,you can just speak to me as jim
0,135,how many calories are in a can of coke
0,118,pass this song
0,65,i need laundry put on my list of tasks to complete
0,32,set a timer for twelve seconds
0,76,tell me my reminders
0,48,do i have a car wash scheduled on my to do list
0,116,what hotel would you recommend in lakewood for 4 people from monday to wednesday
0,48,please read my todo list
0,67,the reservation i created is not necessary anymore
0,31,"what is 20 ounces in grams, please"
0,43,would you let me know what is on my shopping list
0,66,what timezone is viet nam in
0,140,i need to know when i will next have the day off
0,29,can you speak to me using japanese
0,10,can you check who is at the door
0,47,when should i replace my tires next if i last replaced them on july 15th
0,136,how can i know my current location
0,131,my car needs maintenance prepared
0,99,i want to know your age
0,10,set my oven to 350 please
0,106,commence playing music
0,21,can you tell me the song we are listening to
0,114,adios!
0,81,i lost my phone
0,147,quit
0,98,how's the air pressure in my tires
0,111,go ahead and pay my american express bill now
0,0,does the mediterranean grille have good reviews
0,47,how much longer until i have to change my tires
0,82,hola
0,116,i need a room in indianapolis near the track from may 2nd through the 5th
0,129,share with me a fun fact about outer space
0,86,how long will the chicken take to cook
0,78,how much time does it take to get to levi stadium from san jose airport
0,139,what does alternative mean
0,74,what are the benefits i get for my health
0,121,no clue
0,99,lemme know when you were born
0,119,i need to change your voice settings
0,5,tell me what the weather is like
0,128,is las vegas a safe place to visit
0,120,what kind of plug do i need for my razor in ireland
0,125,"do i have pepper my shopping list, if not add it"
0,142,what's the fuel economy for this car downtown
0,128,does france have any travel alerts i should be aware of
0,39,book an uber suitable for seating 5 individuals and headed for the mall
0,123,should i get an oil change
0,98,i want to know how low the air in my tires are
0,144,i prefer to go by brad
0,47,when are my tires due to be changed
0,128,i am thinking of going to brazil and was wondering if that is hazardous
0,96,which company can i credit your design to
0,36,heard any good jokes lately
0,62,what can't i carry-on to delta
0,40,i will be in boston from march 2 to march 4 can i rent a car for that time
0,66,miami time zone is what
0,92,"ai, please roll the dice"
0,24,i have to know what the traffic typically like at 3:30 on the route to phoenix
0,80,at what point will this flight start letting people board
0,95,what's the day of the week
0,68,view my transactions for the last week
0,17,i need diy info about jump starting my dead car battery
0,48,i wonder what my to-do list looks like for today
0,100,i nee to know how to transfer my 401k
0,30,definitely not
0,110,do i have enough fuel to get to orlando
0,150,increase the volume level to 4
0,24,is there traffic on bramble lane
0,56,what's the due date for the renting bill
0,104,can you find me a recipe for pasta
0,86,how long to microwave a frozen dinner
0,92,will you roll a 4 sided dice
0,116,"i'd like you to book me a room in austin near google's headquarters from january 01, 2020 to february 02, 2020"
0,46,suggest a meal from burma to me
0,96,you were built by who
0,124,thanks
0,114,bye for now
0,34,do you have many kinds of pets at your house
0,147,stop doing that
0,92,roll an eight sided die
0,106,can you put on music by beach house
0,36,tell me a joke about dogs
0,28,how can i build credit
0,72,i need to know how to get to target by bus
0,141,put the song that's playing to my techno playlist
0,146,i need to tell bank that i am taking a trip to asia
0,121,sorry no idea
0,48,do i have an item on my todo list related to shopping
0,14,turn your volume up
0,107,yes you are correct
0,31,how many kilos are in 10 pounds
0,86,how long does it take to bake a pork loin
0,107,"agreed, that's valid"
0,47,how often should i replace my tires sense i replaced them on 2/21/17
0,88,do a hard reset to factory settings
0,85,please confirm my reservation for kevin at red robin
0,54,"so it seems i have had pizza in the fridge since monday, so is it safe to eat"
0,47,"i got my new tires a month ago, when should i replace them"
0,117,is there anything real about you
0,14,"go back to whisper mode, please"
0,11,what's my name huh
0,52,is it recommended to get any specific shots before i travel to japan
0,57,are you working for another person or entity
0,145,can you tell me the best place for cajun shrimp in tampa
0,102,what is the wait supposed to be at zippys
0,63,make delta reservation from madison to atlanta
0,38,let me know what the exchange rate between dollars and pesos is
0,8,what's the correct fuel type for my car
0,37,when did i last service my car with an oil change
0,76,read back the reminder list
0,54,how long is pork good in the fridge
0,62,does delta have any carry-on restrictions
0,130,create a link with my phone
0,67,tell the restaurant i cannot make it
0,1,give me the nutritional information for mashed potatoes
0,29,i would like to change your language from portuguese to italian
0,23,i would like you to secure a 4:30 pm reservation for five people at morton's steakhouse
0,77,in what state were you born
0,141,adding gods plan to new playlist
0,130,you can disconnect from my phone now
0,136,"how do i find my location right now, please"
0,75,how can i get your attention
0,130,go ahead and connect to my phone
0,9,can you tell me if zeus does reservations
0,61,how could i say twin in chinese
0,38,how many dollars can i exchange for 10 yen
0,7,"if i'm using citibank, what is the interest rate"
0,54,will it be all right for me to drink milk i've had in the fridge since tuesday
0,57,who directs your labor
0,110,how low is my gas tank
0,124,"i really appreciate your help, thank you"
0,18,are there meeting rooms available between 11-12
0,148,"how many sick, personal, and vacation days have i billed so far this year"
0,0,tell me the reviews for chipotle
0,142,do you know what this car's mpg is
0,107,that is accurate
0,67,cancel the reservation for joe and i right now for the zephers reservation we had booked
0,55,i want change your name to russ
0,61,what do spanish people say for the word cow
0,96,who made the ai
0,104,can you get me a recipe for mashed potatoes
0,70,i have suspicious charges on my discovery card
0,56,when should i pay my bill by
0,40,i would like some help getting a rental car reserved in los angeles
0,120,are socket converters needed in lisbon
0,83,set an alarm to go to sleep and another to wake up
0,149,what's a nice place to visit a beautiful beach
0,14,please speak with the whisper voice
0,83,i want an alarm at 5pm
0,66,italy is in what timezone
0,71,how much have i spent on food recently
0,72,where can i find the mall closest to here
0,120,are the plugs different in barcelona
0,29,please respond in latin from now on
0,140,what day am i off next
0,131,book an appointment for an oil change
0,19,do i have any meetings today between 4 and 5
0,31,what would be the conversion between tablespoons and teaspoons
0,136,where am i located currently
0,1,what's the nutrient info for a donut
0,140,what holiday's are comming up next
0,75,does the ai have a name
0,131,i want to to schedule maintenance on my vehicle
0,5,whats the forecast for the weather
0,149,where do you suggest i plan my next vacation
0,77,what is the area that you came from
0,85,i want my reservation for march 1 at 8 pm confirmed
0,150,i want that volume bumped up to 4
0,39,can you send me an uber to go to a restaurant in downtown phoenix
0,48,i need to know if cleaning out the fridge is on my to do list
0,97,schedule a pto request for me on march 1-2
0,80,can you tell me what time this flight is going to land
0,26,please send a text
0,76,what reminders did i have
0,79,what day will i get paid
0,135,what's the number of calories in a pepsi
0,108,how do i go about setting up direct deposit
0,135,i need to know the number of calories on average in a handful of pistachios
0,128,does italy have any travel alerts i should be aware of
0,128,should i know about any travel alerts before traveling in the usa
0,107,"yes, that's affirmative"
0,117,is this human or a robot
0,84,what's the current location of my package
0,98,what is my current tire pressure for each tire
0,67,the reservation i made is not required anymore
0,114,"see you later, alligator"
0,122,is my w2 available at the post office
0,91,i desire to apply for a bank of america travel rewards credit card
0,109,can i get a higher credit limit on my american express
0,35,how much is available in my savings account
0,116,find me a place to stay in cali november 11 to 15
0,9,does gramercy tavern accept reservations
0,146,"let my bank know that i'll be in moscow, russia"
0,73,how is friend spelled
0,117,you sound like a bot
0,13,say it one more time please
0,82,tell me how you've been
0,107,that is correct
0,82,good evening
0,130,please connect with my phone
0,59,is a visa needed to go to mexico
0,123,when am i due for an oil change
0,124,i appreciate that answer
0,86,how long should i spend preparing roast beef
0,65,put wash the counters down on my list of pending tasks
0,78,how many miles until i get to the beach
0,30,"i do not think that is true, so i would say it is a false statement"
0,23,can you get me a table for 4 at red lobster at 8pm
0,51,try a male voice
0,124,i appreciate you helping me
0,72,how do i get to the supermarket on foot
0,87,"my card needs replaced, i accidentally scraped it"
0,124,thanks!
0,79,my next payday
0,35,how much do i have in my checking
0,33,heads or tails please
0,65,cross volunteering off my todo list
0,149,where's a good place to go if i want to see mountains
0,66,can you tell me which timezone is cambodia in
0,146,i'm traveling to fresnosoon and want to inform my bank
0,99,how old are you today
0,105,schedule family dinner on my calendar on march 8
0,125,remind me to buy bread next time i go shopping
0,138,what is 1785 minus 334 minus 87 plus 374 minus 400 plus 17
0,91,"how can i apply for a mastercard, please"
0,115,what can i ask you to accomplish
0,16,please order everything you see on my shopping list
0,18,i have to meet with sam at 9:00am in two days
0,80,i would love to know when my flight is going to land
0,29,select a new language
0,107,that is true
0,37,when did i last do maintenance on my car
0,92,roll this dice
0,112,list the ingredients in pizza
0,12,i can't find my student id card and i want to report it as lost
0,147,"ai, cancel that last request"
0,94,what is the tax amount
0,123,how soon should i have my oil changed
0,99,what is the exact date of your birth
0,2,why am i seeing a hold on my boa account
0,85,i would like to try and confirm that i have a reservation at macaroni grill for silva
0,147,abort
0,9,does buffalo wild wings do reservations
0,48,can you look to see whether feeding the fish is on my to do list
0,89,i cant recall my pin number for my city first account
0,135,how many calories would i estimate for fettuccine alfredo
0,105,i want to add farm trip to my calendar for friday
0,80,when is my plane scheduled to land
0,52,which shots do i need to get before i go to africa next week
0,110,i need to know how much gas is left
0,16,i need everything ordered on my shopping list
0,47,how soon should i replace my tires from yesterday
0,117,"are you a computer, or are you a real person"
0,57,don't you work for your self
0,144,i go by the name jim
0,139,what is the definition of flange
0,149,provide me with ideas of things we can do in charlotte
0,110,is there enough fuel to drive to tampa
0,120,what is the plug type in france
0,39,help me get an uber
0,149,what are some interesting things to do in dc
0,104,i need a recipe for beef
0,150,raise the volume to 4 please
0,88,"restore your factory settings, please"
0,32,please set timer for 4 pm
0,53,please give me a reminder
0,85,please confirm my reservation for 2/20 at 8 pm
0,18,can you sign me up for a meeting in the blue room on friday
0,59,i want to visit portugal do i need a travel visa
0,24,is there any traffic on the way to the bank
0,63,please get me a flight booked from miami to dallas on american airlines
0,119,speak at a slower rate
0,104,how do i make a taco that's worth eating
0,113,i flew on southwest airlines flight ab123 out of dallas and i can not find my luggage
0,141,add this song to my top 40 playlist
0,8,does this care use premium gas
0,22,who can tell me if there's any meaning to life
0,32,can you please the timer
0,95,what year is it
0,27,how much is my groceries and gas bill
0,48,is fixing mom's kitchen blind on my to do list
0,131,i'd like to get an appointment to get my oil changed
0,61,i would i say subway if i were english
0,81,tell me where my phone is
0,35,is there any money left
0,9,do they accept reservations at michael's
0,34,do you have any pet animals
0,130,stop syncing with this phone
0,100,transfer my 401k please
0,65,add schedule appraiser to my to do list
0,140,"when is the upcoming holiday, please"
0,58,please share my location with my boss and my lawyer
0,98,what's my tires' air pressure
0,33,lets flip for it
0,19,"tell me my scheduled meetings for today only, please"
0,5,what is the record high temperature for today
0,88,i want to reset your settings to the original
0,124,i'm grateful to you
0,78,how long does it take to get to red robin on phoenix
0,3,how do i change the oil in my car
0,52,is it recommended to get specific shots before i travel to japan
0,121,either or should work
0,13,"i missed what you said, please say it again"
0,29,can you swap the language to afrikaans for me
0,86,how long do you cook a salmon
0,24,i wanna know what the traffic typically like at 3:30 on the route to phoenix
0,37,when did i last have a mechanic check out my car
0,65,add mop bathroom to my to do list
0,55,i'm going to start calling you alice
0,11,do i have a name to you
0,30,what you just said is false
0,36,tell me a joke about lawyers
0,102,please look into the current wait times at chili's right now
0,141,can you add that to my chillwave playlist
0,42,what is the current market trend
0,66,las vegas timezone please
0,1,how healthy is tomato soup
0,30,"no, that information is wrong"
0,59,does travelling to that place require a visa
0,148,check to see how many days off i have used
0,106,"i want to listen to my maroon 5 playlist, play it for me"
0,7,can you help me find the interest rate for my sba account
0,54,how long does cottage cheese keep in the fridge
0,72,i want directions to the closest atm
0,77,what state were you born in
0,140,when is my next vacation day
0,104,can you search for the best new york style cheesecake recipes please
0,128,does ireland have any travel alerts i should be aware of
0,75,what do you like being called
0,0,what is the sushi like at yakamoto
0,88,i'd like to switch back to my factory settings
0,136,is there a way to get my current location
0,23,can you set me up for a reservation for five at outback steakhouse on february 28th at seven pm
0,60,what does my schedule look like for april 1
0,18,i want to know how do i schedule a meeting
0,59,what documents to i need to go to egypt
0,108,how do i get direct deposit for my paycheck
0,108,i'd like my paychecks direct deposited in my navyfed checking account
0,35,what what kind money is available in my bank accounts
0,55,i'm going to start calling you kobe now
0,51,switch to british male accent
0,0,how good are the ratings for the olive garden
0,132,what apr do i have with my credit card
0,150,turn up the volume level to 4
0,109,can i increase the credit limit on my kohls card
0,130,can we pair this with my new phone
0,80,whats the status of my delta flight
0,59,does moscow require travel visas to visit
0,135,what is the total number of calories in a bag of potato chips
0,71,please list my total spending on grocery shopping for the last two months
0,53,i'd like to have a reminder made
0,123,when do i need you change my oil
0,80,is flight dl123 on time
0,80,i would like to know when my flight scheduled to board
0,122,can you tell me what the form is employers are supposed to send you for taxes and where i get it
0,99,do you know exactly when you were born
0,118,start playing the next track
0,89,change my pin to 1234 on account ending with digits 4994
0,126,how many vacation days do i have to spend
0,14,switch to whisper mode
0,96,what company manufactured you
0,11,by what name people call me
0,140,when can i expect the next holiday here
0,118,please put on the next number on this playlist
0,88,reset the factory settings please
0,130,please get off my phone connection
0,131,"please find someone who specializes in cars, my check engine light has turned on"
0,38,what's the currency conversion between usd and yen
0,51,use male voice now
0,11,what would you like to call me
0,73,how do you spell friend
0,136,using this map i'd like to see my exact whereabouts
0,144,i need to change my username
0,88,reset to factory default
0,76,do you know what things i wanted to remember
0,86,what's the preparation time for spaghetti
0,10,what's the persons name at my door
0,93,how much money do i bring in
0,77,where was it you were made
0,34,tell me whether you are a cat or dog person
0,37,how long's it been since my car was at autozone
0,26,write text message to someone
0,14,whisper from now on
0,120,do visitors to japan need to use a socket converter
0,35,do i have enough money in my first hawaiian bank account for a vacation
0,117,are you a live human being
0,77,where are your origins located
0,122,where do i get my w2 form from
0,88,return to default settings
0,24,can you tell me about the traffic typically at noon on the route the hospital
0,47,when should i get new tires i just replaced them
0,141,include happy on my rb playlist
0,22,how is life in existence
0,121,who knows
0,150,lower the volume
0,90,is my replacement card coming soon
0,114,catch you around
0,0,what are the ratings about at pho king
0,24,how is the traffic on the way to work
0,113,how do i go about resolving my luggage that didn't arrive
0,114,it was nice to converse with you
0,120,which type of plugs do they use in scotland
0,129,can you tell me a fun fact regarding cars
0,15,can you tell me about your hobbies
0,124,i appreciate that
0,31,how many meters are in 50 feet
0,19,do i meet with joan today
0,46,suggest an italian meal for me
0,123,how often should you get an oil change
0,18,schedule a meeting with tom for 6pm
0,32,i want to set a timer
0,39,i need an uber to the doctor
0,0,what are the reviews like for bar tartine
0,112,what is gumbo made of
0,31,how many meters are in 2 inches
0,134,what about changing the sugar for baking soda
0,110,do i have enough gas in the fuel tank
0,51,switch over to the male voice mode
0,116,"find and book a hotel in md, baltimore starting on the 7th to the 9th"
0,43,does my shopping list consist of chips
0,52,do i need specific shots before traveling to germany
0,66,tell me the timezone las vegas is in
0,75,"ai, what's your name"
0,147,do not complete the task that i gave you
0,106,play the song that goes like hey jude don't make it bad
0,50,what's the reward point count on my discover card
0,55,please change the ai name for me
0,135,what is the calorie count in a cookie
0,65,cleaning needs to go on my list of things to do
0,57,i gotta know who is your boss
0,105,please remove fishing from my calendar for soccer
0,56,when's the next time i have to pay the insurance
0,141,please add someday by the strokes to my playlist
0,53,i need to take out the trash please remind me
0,52,what are the recommended shots to get before i travel to south korea
0,3,tell me how to change the oil in 2014 odyssey
0,58,share my gps coordinates with jim
0,134,can i use sour cream instead of milk
0,15,what do you do in your free time
0,51,can you change the way you talk to a male british voice
0,98,should i pump my tires
0,143,what is the smallest payment i can make toward my xfinity bill
0,57,who do i work for
0,55,change your name setting to plato
0,97,i need to put in a pto request for march 4 to march 6
0,33,i want you to flip a coin
0,24,how's traffic en route to virginia
0,76,do i have anything in my reminders
0,86,how long do you cook a hamburger for
0,131,is there someone in the area who can check my engine light since it is on
0,146,notify my bank that i will be in rome from february 1 to march 1
0,125,take frozen food off my shopping list
0,60,do i have anything on my calendar for march 2nd
0,105,add farm trip to my calendar for friday
0,76,check if getting a light bulb is on my list of reminders
0,65,i no longer need to wash dishes; take it of my list
0,139,exactly what does altruism mean
0,119,is it possible to speed up of your replies
0,86,how long should a cake bake
0,114,it is time to say goodbye
0,56,how do i ascertain when my next insurance payment will be
0,59,does france have their own version of a visa
0,119,speak slower
0,17,guide me through jump starting a car
0,57,you work for what company or person exactly
0,14,talk in whisper voice
0,57,who do you call your boss
0,19,"for today only, how many meetings are with jake"
0,116,please book me a place in pittsburgh to stay from monday to friday
0,126,how many vacation days do i have for the year
0,55,please open a call to my mother
0,9,does iron skillet at the truck stop trake reservations
0,147,shhhh
0,47,when am i due for a tire change
0,85,can you check my reservations for mortons under david winters
0,11,what is my first name saved as
0,136,where am i right this moment
0,19,do i have to be at any meetings today
0,141,please put this song on my moody monday playlist
0,39,can i get an uber for 2 home
0,122,how do i get a w2
0,149,what are some of the attractions in gatlinburg
0,22,whats lifes meaning exactly
0,93,what is my current gross salary
0,72,please give me directions to the nearest starbucks
0,104,where can i look to learn to make sushi
0,146,tell the bank i will be traveling internationally soon
0,59,do i need a visa to leave the country
0,141,please put africa by toto on my playlist
0,8,what sort of gas does the car need
0,22,what is your perception of the meaning of life
0,67,can you cancel my reservation on tuesday for chris at stella maris
0,107,yes
