0,108,what are the steps for setting up direct deposit for my paycheck
0,46,i would love an italian meal suggestion
0,42,how many players are on the chicago bulls
0,118,put on the next song
0,57,who else do you work for
0,107,"yes, i'd really like that alot"
0,22,do you know what the meaning of life is
0,21,do you know what this song is
0,136,please tell me my current location
0,67,can you cancel my dinner reservation
0,46,suggest a meal from thailand to me
0,146,how do i inform my bank i'm going to paris
0,49,i wanna know why my card was declined
0,131,how do i schedule car maintenance
0,9,do you know whether ihop does reservations
0,48,please read out my list of tasks to accomplish
0,55,"if i may, i'd like to call you slave"
0,91,what if you want to obtain a new credit card
0,146,"from january to august, i will be in uruguay, please let me bank know"
0,139,i want to know what the word discomfit means
0,48,please remind me of the tasks on my to do list
0,129,list some neat stuff about rats
0,52,are there recommendations to get any specific shots before i travel to germany
0,143,what is the bare minimum for my truck payment
0,24,what is the traffic like on the way to north shore
0,38,how many dollars can i exchange for 10000 rubles
0,115,i wish to know the types of subjects are you familiar with
0,149,what are some of sweden's best sights
0,47,when do my tires need to be changed again
0,134,can i use baking powder instead of baking soda
0,125,make sure walnuts is on my shopping list
0,73,i want to know how to correctly spell cemetery
0,61,how would i say pleased to meet you if i were japanese
0,17,tell me how to jump start my own car battery
0,77,where were you created
0,118,skip this song and play the next one
0,14,please shut off whisper mode for now
0,43,list everything on my shopping list
0,149,is there anything fun to do in berlin
0,104,find a recipe for german chocolate cake
0,80,whats the most recent status for my virgin air flight
0,27,how much do i have to pay on my bills
0,76,what did i include on my list of things to remember
0,91,help me get an american express card
0,104,you know procedure to cook apple pie
0,84,when will my package arrive
0,118,go to the next song now
0,134,is it acceptable to swap beef for tempeh
0,141,"add the thong song by cisqo to my playlist, please"
0,14,use your whispering voice
0,130,would you disconnect from my phone
0,11,what name am i under
0,93,how much have i earned
0,39,"i would like an uber going to the train station, please"
0,11,by what name do you refer to me
0,32,set a new timer for ten seconds
0,59,i need to know if i must have an international visa to go to france
0,52,do i need to get any shots to travel to mexico
0,13,i did not understand say it again
0,13,i am needing for you to say that again
0,137,what are the international transaction fees for my chase card
0,22,what's the point of sentience
0,150,go ahead and increase your speaker volume
0,21,what song am i listening to
0,118,what's next on the list
0,9,does hannahs in galloway take reservations
0,76,i want to hear what is on my reminders list
0,54,tell me when the milk will expire
0,9,does tartine in san francisco take reservations
0,42,are there any local stations covering the moral march in raleigh in februaryu
0,86,what is the prep time for a 10 lb turkey
0,29,can you speak to me in french
0,47,tell when should i get my tires changed next
0,98,can you check my tire pressure
0,40,"id like a car rental between january 1st to the 3rd in denver, id like a ford"
0,98,would it be smart to put air in my tires
0,24,is there traffic on my way to work today
0,114,take it easy!
0,60,what is there on january 1st on my calendar
0,9,does bar tartine in san francisco take reservations
0,52,would i need any immunization if i go to thailand
0,39,set me up with an uber
0,58,trey needs my current location
0,135,how many calories does a kitkat have
0,67,end my reservation with carl at umami
0,29,please talk to me in spanish
0,51,use a male voice now
0,122,where do i pick up a w2 form
0,30,not really
0,19,do i have to meet the dev squad to day
0,33,i will determine it with a coin flip
0,58,can you let sam and woody know where i am
0,76,what do i want to remember
0,23,book a reservation for 2 at olive garden under the name jim
0,92,i want to roll some dice
0,66,"if i’m in japan, what time zone am i in"
0,46,go ahead and give me a suggestion for what to make for dinner
0,146,please tell the bank i will be traveling internationally
0,102,i would like to find out if macaroni grill will be busy around 7:00 pm
0,120,do i need a power adapter in mexico
0,0,does the bleu olive have decent reviews
0,3,what kind of oil does my car take and how do i do a change
0,119,"please increase the speed of your speech, it is too slow"
0,39,i need an uber to the movies
0,100,"since i got a new job, i need help with my 401k rollover"
0,8,what kind of gas does my vehicle take
0,66,what timezone is japan in
0,60,what is on my calander for valentines day
0,87,report my burned card to the company
0,30,the answer is no
0,130,let's terminate connection to my phone please
0,21,what am i listening to
0,59,do i need an international visa to go to spain
0,131,my car needs an appointment for an oil change
0,135,looks up the calories in cheetos
0,145,help me find a good sushi spot in chicago
0,75,i want to know your name
0,17,what do i do when my car battery is dead
0,146,im going to be in jamaica from october 4th until october 8th
0,88,i'd like to revert to factory settings
0,53,remember to remind me of this later
0,130,i need for you to connect to my phone
0,76,is there a reminder for my aa meeting on my list
0,110,am i low on gas
0,8,will this car run on the cheaper gas
0,2,why was a hold placed on my wells fargo account
0,43,do i need milk at the store
0,23,can you get me a table for two for 8:00 pm at parc
0,37,what date did i last take my car in
0,51,please use a male voice when speaking
0,72,what are the directions to get to olympia by bus
0,57,who else commands you
0,119,"talk slower, please"
0,106,"find the song with, ""baby shark, doo doo"
0,144,i am josh
0,144,people call me gary
0,128,is traveling to dublin safe (will dublin be safe)
0,53,remind me later
0,75,i didn't get your name
0,75,what name should i use for you
0,53,"make a reminder, pay taxes on monday"
0,38,500 dollars equals what in pesos
0,101,whats going on with my day off request
0,115,what types of things are you able to do
0,147,shut up!
0,66,can you tell me the timezone that hartford is in
0,133,i need to transfer from one account to my second one
0,42,where is the dipstick
0,11,"what is your name for me, please"
0,129,what would be a fun fact about cats
0,34,i must know what kinds of pets you have
0,7,i must know the interest rate on my bank of america cd account
0,70,please report information about activity on my credit card
0,142,what'll this car do for gas mileage on the open road
0,108,i want to switch to direct deposit
0,39,i want to reserve an uber to go to the airport
0,64,i must switch to a new insurance plan
0,145,are there any sushi restaurants in reno that have good reviews
0,76,will you repeat my reminder list
0,150,make the volume 4
0,39,i need an uber
0,88,go to default setting
0,10,turn lights on in the garage
0,128,are there travel notifications for columbia
0,77,where is the location of your creation
0,51,can i get you to talk like a pouty english guy
0,50,what is my american express card's rewards balance
0,34,i gotta know what kinds of pets you have
0,101,has my vacation request been denied or approved yet
0,72,how would i get to city hall via bus
0,52,which shots do i need before i go to thailand
0,24,what's the traffic typically like at 3:30 on the route to phoenix
0,58,can you tell bob and alice where i am
0,9,can i get a reservation at champs
0,62,let me know how many carry ons i can take on a flight with southwest airlines to dallas
0,0,does chili's have good reviews
0,83,wake me up at noon tomorrow
0,48,can you read my to do list to me please
0,13,can you tell me what you just said
0,110,what level is my gas at
0,102,how long is the wait at imanas
0,145,can you suggest a restaurant for me to eat tonight
0,38,how many swedish kroner do i get for a dollar
0,83,set my alarm for 6am tomorrow
0,85,verify that my reservations at won wons for joe lee are good
0,10,are my doors locked right now
0,41,can i please know the credit limit for my citibank card
0,55,can i change your name
0,11,what is the name you call me
0,121,i'm uncertain
0,72,how do i get to the nearest post office
0,126,can i get vacation day totals i have left
0,13,i did not hear you
0,29,can you speak to me in chinese
0,144,you can call me carrie
0,16,can you order underpants for me
0,51,i need to switch to the male voice
0,82,how are things with you
0,3,give me instructions on how to change my oil
0,30,that's a hard no from me
0,78,"from here, i take this bus to go to brooklyn and how long is the commute"
0,137,what are the foreign transaction fees for cuba
0,144,usually people refer to me as brad
0,73,can you help me spell facetiousness
0,47,how often do you change your tires
0,82,hi ai
0,30,no!
0,113,find me the number for jet blue's customer service so i can yell at someone about my missing luggage
0,77,can you tell me where you were created
0,142,what is the amount of miles per gallon this car gets on the highway
0,79,please give me the expected arrival date for my next paycheck
0,54,"i have potatoes in the cupboard from wednesday, are they fine"
0,37,let me know when my car was last looked at
0,80,could you tell me the status of my frontier flight
0,9,will qdoba take reservations
0,141,favorite what's currently playing on my playlist
0,34,how old are your pets
0,98,how are my tires
0,48,"what do i have to do tomorrow, according to my to-do list"
0,18,could you please schedule a meeting with carrie and lisa
0,54,is it okay to eat chicken that i put in the fridge on monday
0,119,can you slow down how fast you talk
0,79,when was the last date that i was paid
0,130,"initiate connection with my phone, please"
0,120,what kind of plug does my hair dryer use in south korea
0,80,whats the status of my united flight
0,121,it could be possible
0,141,add 7 rings to my pop playlist
0,112,what ingredients are present in marshmallows
0,118,stop this song and go to the next one
0,29,can i start talking to you in spanish
0,102,how busy does outback get around 7pm
0,60,do i have anything scheduled on january 1st
0,52,what shots are recommended before traveling to kenya
0,48,what have i got on my to-do list
0,13,please repeat over what you said
0,67,please unreserve that table
0,113,i believe it looks like my luggage has disappeared
0,132,what is the apr on my master card
0,139,what is the meaning of stupendous
0,106,put my workout playlist on
0,21,what's the song currently playing
0,105,please add final exams to my calendar for may 2
0,23,"call and make a 5:45 pm reservation for jason rogers, table for four"
0,14,exit out of whisper mode
0,40,find me a rental car from 2/28 - 3/1 in reno
0,61,can you translate where's the bar into irish for me
0,2,"my account is blocked, help me figure out why"
0,150,make the speakers louder
0,43,did i put milk on the shopping list
0,52,do i need any vaccinations before going to indonesia
0,88,go back to your factory settings
0,141,add this song to my post-rock playlist
0,75,do you have a preference regarding what i should call you
0,13,could you say that again
0,125,remove carrots from my shopping list and add soda
0,142,how much mpg does this car get in the city
0,120,is there an outlet plug adapter
0,24,what's the traffic like on my way to the terminal
0,114,good bye my friend
0,53,make me a reminder that tommorow is trash day
0,143,show me the minimum payment for my boat bill
0,52,are there shots required before going to south africa
0,46,do you have any good recommendations for swiss cuisine
0,59,do i need a visa to spain
0,144,i go by brad
0,128,does spain expect any travel alerts
0,63,i want to book a flight from hawaii to new york on july 8th and returning on july 10th
0,130,please disconnect from my phone
0,15,what kinds of activities do you enjoy
0,48,what chores do i have waiting on my reminder list
0,105,i no longer need to go to the zoo on the 8th of this month
0,10,make sure the oven is set to 350 please
0,98,let me know how low the air in my tires are
0,33,i want a coin flipped
0,52,are there specific shots i need before traveling to japan
0,106,"that ""baby shark, doo doo,"" song, i want to hear it"
0,129,do you know any fun facts about australian football
0,53,make reminder to pay rent on the 30th of every month
0,62,tell me how many carry ons i can take on a flight with southwest airlines to dallas
0,53,i need a reminder to remind me to do something
0,120,what kind of plug type do they use in russia
0,15,how do you like to spend your free time
0,36,tell me a joke about rats
0,21,tell me the title of this song
0,115,what kind of questions do you accept
0,18,is there an open meeting room between 2 and 4
0,115,what sorts of subjects are you well versed in
0,114,glad we got to talk
0,24,is traffic bad on the parkway
0,142,what is the mpg
0,118,go to the next song and skip
0,130,stop the connection with my phone
0,97,please tell me how to submit a vacation request
0,23,"now, i need a reservation for backwoods crossing at seven for 6 people"
0,150,change the speaker volume to a louder one
0,80,what is the word on flight dl123
0,37,when did i last bring my car in to have it looked at
0,85,i need to make sure there is a reservation for george at connor oneil's
0,123,when would it be required for me to get my oil changed
0,50,tell me how to check rewards for my mastercard
0,33,let's decide with a coin flip
0,13,i want to have that repeated for me
0,3,how do i do an oil change and what type do i use
0,101,how's my day off request looking
0,14,i need your setting switched to whisper mode right away
0,106,i want to hear beatles music
0,83,i need an alarm to wake me up at 8 tomorrow morning
0,54,"i have tomatoes from tuesday, do you think those are still good"
0,123,how long can you go between oil changes
0,139,"what is the meaning of word ""rescind"
0,65,i need to do cleaning so add it to my to do list
0,121,i don't really know
0,63,purchase a flight from slc to columbus on tuesday that returns on friday
0,146,alert the bank that i am traveling to tokyo on the 7th until the 21st
0,49,my card was malfunctioning and was returned to me
0,55,i want to change the name i call you to juan
0,126,can you explain to me what type of vacation days i have still
0,52,do i need vaccinations to travel overseas
0,21,what is the current song
0,9,do they take reservations at state bird
0,55,can you change the name of what you respond to
0,64,i want to switch my insurance coverage
0,108,how to direct deposit my paycheck
0,147,"stop working on it, i need something else"
0,1,what's the nutritional info for a cheeseburger
0,21,the song on speaker is what like
0,7,would you tell me the interest rate
0,10,please lock the doors
0,11,what name do you know me by
0,20,please block my chase account right away
0,81,can you call my cellphone
0,93,tell me my salary please
0,49,i was at trader joe's trying to buy groceries and my card got declined
0,108,help me set up direct deposit to my bank of hawaii checking account
0,142,how's the mpg for this on the freeway
0,63,book a flight from sacremento to tampa two weeks from now and returning a month after
0,150,lower volume level
0,134,it is okay to use water in place of milk
0,125,add cherrios to the shopping list
0,49,please let me know why my card was declined yesterday
0,57,who do you function for
0,79,i need to know when to expect my next paycheck
0,116,"i'd like a placed booked in san diego from may 1st, 2020 to june 2nd, 2020"
0,65,please include laundry on my to do list
0,147,please be quiet
0,40,can i rent a car out of lax from tuesday to thursday
0,48,let's go over the list of items on the to do list just to be sure we got it all
0,12,"my card is stolen, i need to report it"
0,17,do i need cables to jump start my car
0,8,tell me what type of fuel i need to use for this car
0,80,please tell me when my flight will land
0,8,i wanna know the gad i need to fill this car up with
0,69,how exactly do i find my credit score
0,84,where is my delivery order
0,102,how long is the wait at assagios today
0,73,how do you spell antithesis
0,116,book me a hotel in new york near the empire state building from marc 2nd to 4th
0,88,go back to the factory settings for this device
0,125,add flour to my shopping list if it's not already on it
0,29,i want your responses to be in french
0,105,lunch with deb at noon today
0,80,when will my flight land
0,78,"if i go by bus, how long will it take to get to the airport"
0,77,what area were you born in
0,74,what are the health benefits i have
0,1,how healthy are lunchables
0,120,do i need a plug converter when i visit france
0,102,how busy will panera be at noon
0,61,what is spanish for good morning
0,136,how can i go about finding my current location
0,136,could you find my location on the map
0,24,at around noon what is the traffic typically like on the route to the hopsital
0,31,what's 8 ounces in cups
0,13,can you say again
0,1,please fill me in on the nutrition facts for shrimp scampi
0,134,can i use baking soda instead of baking powder
0,92,i would like the dice to be rolled
0,84,can you see if my order was delivered
0,6,what are ways to utilize my credit card points
0,73,i need to know how to spell conscience
0,120,inform me as to the plug type of the country
0,99,tell me how old youare
0,119,you should talk faster
0,52,should i get any shots before i go to kenya
0,119,how do i change the speed of my ai's voice
0,137,for my card is there a extra card while i'm staying in italy
0,72,i want to know the nearest bank's location
0,95,"after another eight days, what day will it be"
0,48,tell me what is on my todo list
0,141,add this track to my rock playlist
0,54,has the leftover hamburger from last saturday gone bad
0,84,will my order be here by saturday
0,41,how much to i have left on my visa card limit
0,106,i'd like to hear my workout playlist
0,147,terminate current process
0,61,what is thank you in spanish
0,115,what kinds of things can i ask you
0,30,"that's not right, so no"
0,112,i need to know the ingredients in a hamburger
0,119,how do i change your options so that you speak more slowly
0,106,can you play music
0,29,change your spoken language to english
0,43,show shopping list
0,125,delete fries from shopping list
0,145,are there any decent places to get seafood in seattle
0,86,what is the proper time to cook steak for
0,147,scratch
0,54,how soon until the milk expires
0,129,"about something,tell me some trivia"
0,65,can you delete lunch with david from my to do list
0,98,what is the current tire pressure level in the car
0,129,what is an amazing trivia fact relating to 3d printing
0,34,can you tell me if you have any pets
0,78,how long does it take to get to spago's in los angeles
0,100,can you help me figure out how to rollover my 401k
0,135,how many calories are in a cookie
0,84,track my package now please
0,103,has the discover card approved my app
0,45,i want to know my routing number please
0,55,can i change your name please
0,68,get me access to a list of my recent transactions
0,79,when was the date that i was last paid
0,67,could you please cancel my reservation for 5 at red robin
0,24,what is the traffic like on the way to makaha
0,149,what's the best place to travel to this time of year
0,105,make sure april 1 is clear on my calendar
0,78,about how much time will it take to get to the laundry in this area
0,7,what is the interest rate on my scotiabank account
0,65,will you please put remember to drop off at the dry cleaner's to my current to do list
0,8,what kind of gas does this car need
0,84,help me find my package
0,51,please use male voice
0,61,how would you say can i borrow five dollars in portuguese
0,61,how would i say if i were english subway
0,142,please tell me what the mpg is for this car
0,100,can you instruct me on how to rollover my 401k
0,123,about how long before i need another oil change
0,20,i need to hold off on my account
0,84,when will my order be here
0,73,i don't know how to spell theater
0,54,how long will my milk be good in the fridge
0,24,how's highway traffic today
0,49,i was at target trying to buy candles and my card got declined
0,46,can you give me a french dinner suggestion
0,5,is it cloudy or sunny in sparks
0,72,how close is a gas station to mcdonalds
0,146,i'm travelling to spain soon and want to inform my bank
0,135,what's the caloric content of an apple
0,40,can you show me how to book a car rental in manitowoc
0,34,would you tell me what kind of pets you have
0,96,how was this ai created
0,89,i'd like to change my pin number for my savings account
0,38,what's 11 yen in pounds
0,58,share my gps location with steve
0,63,use delta to book me a flight from dallas to pittsburgh
0,124,thank you very much for the assistance
0,75,what name do you want me to call you
0,24,is the traffic typically bad at noon on the route to the hopsital
0,126,do i have any remaining pto days
0,55,i would like to change your name to eli
0,53,set a reminder for my doctors appointment
0,136,would you please tell me my current gps coordinates
0,40,help me book a rental car in green bay
0,74,define my health benefits
0,100,i just got this new job but i need help with my 401k rollover
0,115,what are the kinds of things you can help me with
0,106,play that song hey
0,9,does the steakhouse on main st take reservations
0,136,i need to know my location
0,116,can you book me a place to stay in pittsburgh from monday to friday
0,20,put a hold on my bank of america account right away please
0,119,slow your speech
0,19,is the gang getting together this afternoon
0,138,what is 15% of 3143
0,65,hey just take off everything from my todo list
0,73,how many es are in receiving
0,141,please add this song to my jazz playlist
0,111,"i want to pay my bill, please"
0,99,how many days old are you
0,88,go back the the settings you had originally
0,30,i say negative
0,115,what things can you help me with exactly
0,108,"can you teach me how to set up direct deposit, or show me who can"
0,47,when do i need to get my tires changed
0,82,is everything going okay
0,118,please go to the song after this one
0,37,when did i last have my car fixed
0,73,how do you spell out newspaper
0,62,what is delta's carry on policy
0,4,what time is it
0,92,what do you get if you roll a six sided dice
0,115,what kinds of things would you be able to help me with
0,54,how long is it safe to leave a burger in the refrigerator
0,27,how much in total do i need to pay cox and at&t
0,120,should i bring my socket converter while traveling to england
0,119,will you speak more rapidly
0,57,who would you say your employer is
0,72,how do i get to the leaning tower by bus
0,113,lost luggage on flight america airlines in o'hare
0,105,please add an item to my calendar that i need to clean the kitchen on thursday
0,14,can you whisper until i tell you not to
0,110,what line is the gas tank at
0,39,i would like to get an uber to the movies
0,82,how's ife treating you
0,146,i'm traveling to sweden soon and want to inform my bank
0,83,i'd like a new alarm set for 6am
0,103,can you find out if my application at smith bank was approved or not  i applied for s credit card a month ago
0,120,should i buy a specific plug type when in china
0,106,can you play right above it
0,93,how much money am i making
0,138,what is an 18 percent tip on 20 dollars
0,141,will you please add cannons by phil wickham to my playlist
0,21,what band is this
0,63,"buy tickets for a flight from nyc to la on march 1, returning on march 5"
0,91,walk me through the process of applying for an american express card
0,58,tell lydia and laura where i am located
0,144,call me ishmael
0,21,i need to know what song this is
0,131,i need some work done on my car so need to schedule auto mechanic for maintenance
0,129,tell me some trivia about birds
0,148,tell me the exact amount of pto i have used
0,43,what does my shopping list consist of
0,99,can you tell me when you were born
0,113,"i lost my luggage, what now"
0,22,can you figure out the meaning of life
0,110,am i running low on gas
0,125,put rice and pudding on my shopping list cause i need them
0,92,go ahead and roll the 6 sided dice for me
0,17,where to go to get dead car battery tested
0,51,speak in a male voice
0,68,what was the last thing i purchased
0,116,"please find a columbus, ohio hotel with good reviews"
0,88,i want to put you back to original settings
0,120,do i need a socket converter if i'm going to be in china
0,10,what is the temperature the ac display is showing
0,149,what is there to do besides drink in germany
0,147,"nevermind, cancel that"
0,112,what goes in broccoli cheddar soup
0,141,will you add what i'm listening to to my bedroom playlist
0,60,can you give me an overview of what march 23 will look like for me
0,112,i want to make a meat stew what ingredients do i need
0,140,when does my current job have the next official paid holiday
0,85,i really want to confirm that i have a reservation at red robin for josh
0,31,how many tablespoons are in three cups
