0,43,what products are on my shopping list
0,146,i'm traveling tony soon and want to inform my bank
0,23,"you need to call the melt in lakewood for a table for at 2:00, monday, the first week in march"
0,46,i'd like you to give me an idea for a meal from iceland
0,84,find out the status of my most recent online purchase
0,117,do you know you are not human
0,107,that's a yes from me
0,52,please tell me what shots i am required to get to travel to india
0,82,how's it going with you
0,26,can you text mary and tell them it's ready
0,26,create a new text
0,41,whats the max i can spend on my visa
0,44,how many more days before my credit card expires
0,149,what are some good restaurants in chicago
0,59,i'm going to mexico; do i need an international via
0,69,hows my credit score
0,55,what other names can i give you
0,48,please tell me all the items on my to do list right now
0,3,teach me how to change the oil in my vehicle
0,39,find an uber xl to take me to the kroger near me
0,72,how do i get to the statue of liberty on foot
0,135,what is the calorie count of an apple
0,90,what date will my replacement card get mailed
0,22,what's my meaning in life
0,38,what's the currency conversion between rubles and yen
0,57,are you working for me or what
0,67,i need to cancel my reservations
0,39,can i get an uber for 4 to the mall
0,108,what are the steps to set up direct deposit to my chase account
0,61,how do you say i need coffee in dutch
0,131,make an appointment for an oil change
0,119,please speak slower
0,5,what will the weather be like
0,25,bella needs to be called
0,75,what do you answer to
0,83,i want an alarm to go off at 9 am
0,48,i want to hear my to do list please
0,118,go forward to the next song on the playlist
0,129,what is the most unique piece of trivia relating to cameras
0,120,"in osaka, do i need a plug converter for my electronics"
0,2,can you find out what triggered a hold on my bank account
0,17,find auto store that tests dead car batteries for free
0,22,what's the answer to existence
0,46,suggest a meal for me that comes from mexico
0,58,please tell wanda where i am now
0,80,i need to know the status of my alaska air flight
0,110,can you tell me the amount of gas i have
0,78,"if i leave now, how long will it take me to drive to cape hatteras"
0,141,i wanna add help! by the beatles to my playlist
0,47,tell me the status of my tires and when i need to replace them
0,11,so what is my current name saved as
0,0,what kind of reviews does wendy's have
0,37,what day did i change my oil
0,32,set an alarm for nine minutes from now
0,80,whats the status of my south west flight
0,77,you came from where
0,23,i would like a reservation for 6:30 pm at pietro's under the name david jones
0,72,do you know how i get to olympia by bus
0,38,what is the equal number of dollars i can exchange for 50 pesos
0,39,can you please reserve my uber to go to devon's seafood restaurant
0,125,add bread to my list of groceries
0,123,when do i need my oil changed
0,62,how many carry ons can i take on a flight with virgin airlines to vancouver bc
0,98,are my tires low on air
0,106,play beatles
0,24,how bad is traffic at 8 on the way to burger king
0,43,go over my shopping list with me
0,24,tell me what the traffic is like on the way to phoenix
0,22,is there a meaning to life
0,72,i want to visit chicago by bus what do i need to do
0,102,will there be a wait time at this restaurant
0,113,tell me where my luggage is
0,97,can you put in a pto request for march 7th to the 9th
0,53,i want to get reminded to clean my room
0,78,how long does it take to get to virginia by bus
0,50,what's the current reward amount on my visa
0,68,on my card what all are my latest transactions
0,106,play rock playlist
0,23,please make a reservation at ruth's steaks for a party of five at 7:00 pm under jack arnold
0,107,i vote yes
0,145,could you direct me to any good places in kentucky that serve sushi
0,1,what's the nutritional info for a cup of noodle soup
0,126,how many pto days do i have remaining
0,80,when's my flight boarding
0,3,what do i need to change my oil
0,82,are you okay right now
0,39,i need an uber reserved to take me to the restaurant
0,47,how is the tread on my tires
0,43,on the shopping list did i put tomato
0,29,please speak to me in chinese
0,37,tell me the date of my last car check up
0,140,when is the next scheduled day off
0,38,how many dollars can i exchange for 100000 yen
0,126,how much time off do i have left
0,84,can you find my package in transit
0,80,please inform me when my flight scheduled to board
0,138,can you tell me what 80 divided buy 4 is
0,148,how many personal days have i taken this month
0,136,i need to know my current gps coordinates
0,34,can you tell me the types of pets you have
0,35,can the funds in my wells fargo account cover my lift tickets
0,54,the milk will expire when
0,22,does my life have meaning
0,88,return to your factory settings
0,131,"i don't know why my check engine light is on, i need a mechanic"
0,150,i need you to increase your speaker volume
0,48,do i have watering the plants on my to do list
0,73,i forget how to spell xylophone
0,18,i need you to schedule a meeting with carrie and lisa
0,9,do they take reservations at olive garden
0,42,what's the runtime of all the lord of the rings movies combined
0,23,please reserve a table for two at rouge for 7:00 pm
0,14,switch over to whisper
0,145,"i'm hungry, where should i go"
0,113,i lost my luggage
0,150,i would like the volume lower
0,23,can you make a reservation at the restaurant for tomorrow
0,71,could you check my account and let me know how much i spent on food in january
0,94,tell me how much in tax on this
0,14,don't make too much noise
0,135,please tell me how many calories one chocolate bar contains
0,139,tell me the definition of the word redemption
0,65,"on my to do list, add dishes"
0,110,can i make it to work with my current fuel level
0,131,i gotta schedule some car maintenance
0,128,where are there current travel alerts
0,128,any travel alerts for that country i should know about
0,36,could you share a joke
0,78,what amount of time would it take me to reach the university by bus
0,84,"track package, please"
0,60,when am i next having a meeting in december
0,121,i don't have the answer
0,88,"revert back to your factory settings, please"
0,71,have i been spending a lot on alcohol lately
0,78,how long does it take to get to disneyland in anaheim
0,130,will you please end the connection to my phone
0,61,"how do they say ""how's it going"" in swahili"
0,113,can you help me find my luggage it was lost on delta flight abc123 from houston
0,17,my car battery has died what should i do now
0,122,tell me where a w2 is available please
0,135,what's the number of calories in a coke
0,65,add change filters to my to do list
0,98,what's my tires current air pressure
0,67,cancel my reservation for chris at jp field's
0,82,how is everything with you
0,125,add coke to my shopping cart
0,115,how can i use you
0,64,i would like to alter my insurance plan
0,61,how do you say thank you in spanish
0,12,can you help me report my lost card please
0,113,i need my luggage that your airline lost it was flight abc123 and now it’s suddenly missing
0,144,"my name is stu, not sue!"
0,136,i'm lost
0,74,tell me my health plan
0,144,you can call me james
0,51,can you do a british male accent
0,148,how many days so far have i taken off
0,95,can you tell me today's date
0,113,what step do i take if my bag got lost on the flight
0,16,"i need some more lysol, could you order me some"
0,21,i want to know what song is playing
0,121,i have no idea
0,142,what is my average mpg in this car
0,149,what is there to do in evans
0,96,can you remember who compiled you
0,118,i want to listen to another song
0,83,set the alarm for me
0,34,"what is your favorite, cats or dogs"
0,40,help me get a rental car
0,38,exchange rate between mexico and us
0,150,please increase the volume to 4 please
0,133,what is the process to move money from one account to another
0,38,what's the currency conversion between rubles and pounds
0,57,who do yo work for
0,16,"order some cat for me, i ran out"
0,61,how would i say love in french
0,22,i wonder if you can explain the meaning of life
0,60,i must know what is currently on my calendar for friday the 1st
0,54,what's the shelf life for eggs in the fridge
0,42,what were some of ben franklin's notable accomplishments
0,120,do they use special outlets in australia
0,107,absolutely!
0,110,what amount of gas is in my car
0,4,what time is it in honolulu
0,59,do i need a visa to go to cuba
0,29,can you talk to me in chinese
0,67,"i don't need my reservation, can you cancel it"
0,32,set a five minute timer
0,27,what's the water bill
0,2,i am confused because my account seems to have been blocked for no reason
0,135,tell me the number of calories in a banana
0,113,im at lax and my bags aren't
0,29,i would appreciate it if you could talk to me in french
0,143,please give me the minimum payment total for my sprint phone bill
0,42,how do i open an online line of credit
0,1,what's the nutritional info for chicken breast
0,14,"i can't hear you, stop whispering!"
0,142,what's my car's miles per gallon
0,82,how are you this fine day
0,55,i wanna change your name to audrey
0,51,switch to female voice
0,146,i'm traveling to denmark soon and want to inform my bank
0,34,you have pets of what kind
0,112,what do i need to make spaghetti
0,66,the timezone of italy is what
0,63,i need to get a flight out of lax to dia on the 16th for under four hundred
0,143,what's the minimum i can pay on my sewer bill
0,47,would i need new tires if my last purchase was in may of 2018
0,84,what is the status of my most recent order
0,18,book me a meeting room for 12pm on february 28th
0,78,how long to reach my doctors office
0,116,i need a hotel room big enough for 4 people from monday to wednesday in lakewood
0,74,"which insurance plan am i enrolled in, please"
0,142,what's the non-city mpg for this car
0,22,i wish to know the meaning of life
0,18,schedule a meeting room for friday at 3pm
0,13,repeat what you just told me
0,8,what gas should i fill it up with
0,63,could you make a flight reservation with air emirates from orlando to london
0,51,make your accent the male british one
0,11,what would i be referred to as
0,120,"i'm going out of country, what type of outlet plug do i need"
0,65,"let's go ahead and scratch laundry off my to do list, please!"
0,17,what do you need to jump a car
0,8,what kind of gas does this car use
0,122,what is the location of my w2 that is needed for taxes
0,7,what is the interest rate i can get from the beginning of next year
0,16,i'm out of shampoo so will you order me some more
0,10,can you look who is at the door
0,30,i don't think so
0,3,what do i need to change the oil in my car
0,54,how long will eggs last in the fridge
0,123,how do i know when i have to change my oil
0,49,what was the problem with my card yesterday
0,126,what is the saved vacation time i have left
0,131,help me find someone to look at my check engine light
0,1,can you remember the nutritional info for macaroni and cheese
0,40,could i rent a car in seattle from next monday to thursday please
0,15,what do you do for hobbies
0,8,what type of fuel do i need to use to fill the car up with
0,108,what is required to direct deposit my paycheck
0,113,can you see if you can track where my luggage is
0,118,beginning playing the next tune
0,65,take doing the dishes off my todo list
0,77,what is your place of origin
0,123,when must i change the oil in my car
0,79,when am i paid
0,52,which vaccinations are required to go to viet nam
0,102,is red lobster busy at 6pm
0,99,what is your birth date
0,59,do i need a visa to russia
0,124,thanks for helping me!
0,80,i wish to know when my flight will land
0,23,"please make a reservation for me: party of two, february 22nd at chili's, two in the afternoon"
0,61,how would i say hello in french
0,78,how long does it take to get to orlando by bus
0,114,good seeing you
0,46,would you provide me with italian cuisine dinner suggestions
0,76,read my reminder list to me
0,128,is it safe to travel to rio de janeiro (is rio de janeiro safe)
0,80,give me the status of flight dl123
0,85,can you you confirm my reservation for jean at taco house
0,96,what company's software engineers gave you life
0,9,can i make a reservation for redrobin
0,124,okay thanks
0,51,switch over to the female voice
0,146,i'm traveling to london soon and want to inform my bank
0,8,what type of gas do i need to use in this car
0,46,"suggest a meal from laos to me, please"
0,40,"in aiken, get me a rental for may 12 to may 16"
0,44,how many days until my amex card reaches it expiration date
0,15,what do you do to occupy your free time
0,99,what is your age
0,0,what do people think about the sandwiches at wendy's
0,116,can you book me a room in new york city from april 2 through april 8
0,57,who do you consider your employer
0,120,i have to know what plug that country uses
0,121,it may be either one
0,141,i want to add this song to my classical playlist
0,66,tell me the timezone that spain is in
0,136,what country and city am i in
0,3,how do i change the oil in my passat
0,123,when will i need to change my oil again
0,51,switch over from female to the male voice
0,109,how do increase the credit limit on my visa card
0,36,do you know any good jokes
0,98,would you let me know how low the air in my tires are
0,47,do i need new tires
0,114,i have to go but it was nice talking again!
0,37,when did i take my car to the mechanic
0,58,my friend steve needs my gps coordinates send them to him
0,86,how long should i expect beef stroganoff to prepare
0,78,"usually, how long does is the commute to brooklyn by bus"
0,11,do you know how to refer to me
0,38,how much can i expect to receive if i trade in 6 yens
0,121,i'm drawing a blank
0,111,will you aid me in paying my insurance premium
0,9,do they take reservations at buffalo wild wings
0,99,"what birthday are you celebrating this year, ai"
0,104,i need to know how to make philly cheesesteaks
0,42,how can i get involved in restaurant marketing
0,62,let me know the rules for carry ons for continental
0,118,could you skip to the next song on this playlist
0,119,can you please speed up your speech settings
0,128,does north korea have any travel alerts i should be aware of
0,33,"i choose heads, now flip that coin"
0,74,what's the deal with my health care
0,130,i must disconnect from my phone
0,44,do i need a new card yet
0,40,could you help with booking a car rental for me in seattle
0,119,speak slower please
0,88,get my back to factory settings
0,115,what are the sorts of things i can ask you about
0,96,who is it that programmed you
0,39,"i need an uber with a car seat for 2 adults and one child to take us to wilmington, de"
0,62,how many carry-on items are allowed per passenger
0,97,tell me how to request vacation
0,48,did i remember to add buy flowers to my chore list today
0,66,what time zone is ireland in
0,42,what does my personality mean
0,78,how early should i leave to the airport in la
0,48,i want to hear my to do list read out loud
0,39,can i get an uber to union station for 3 riders
0,115,are there certain types of questions i can ask you
0,54,"is the meatloaf still good to eat, i've had it in the refrigerator since last monday"
0,46,"can you give me a vietnamese meal suggestion, please"
0,80,any idea where flight dl123 is right now
0,43,i need to know the items on my shopping list
0,96,who did the programming on you
0,40,please book a car for me in ho chi minh
0,10,turn tv on please
0,117,are you a real person or a computer
0,108,set my paycheck up for direct deposit
0,103,have i gotten confirmation for my credit card app
0,18,tell me how to schedule a meeting
0,53,set up a reminder to mail a check tommorow
0,74,do you know the health plan i'm on
0,112,what kind of stuff is in potato salad
0,101,will i be allowed to take vacation
0,23,can you book a table at the restaurant for me and my husband
0,73,how do you spell syzygy
0,0,do people like chipotle
0,31,how many meters are in 10 millimeters
0,2,why is there a hold on my discover account
0,37,do you know when my car was last looked at
0,3,how do i go about changing the oil in my car
0,100,help me roll over my 401k
0,7,i want to know my interest rate
0,99,i'd like to know how old you are
0,14,go into whisper mode now please
0,148,have i used any vacation days this year
0,80,please tell me the status of my southwest flight
0,4,what time is it in paris
0,112,what do you put in a tibetan omelette
0,42,get me dwight howard shooting average
0,61,please translate grocery into french for me
0,5,will it snow this weekend
0,3,how do i change my oil and choose the right oil
0,31,how many inches are in 5 feet
0,116,can i book a hotel in new york city near times square from 3/1 until 3/5
0,75,is there a name that you preferred to be called by
0,87,i can not use my card since it is damaged
0,101,give me the status of my vacation request
0,48,did i put unpacking groceries on my to do list
0,102,how long will it take me to be seated at ihop
0,145,what's a good place to eat chinese in san francisco
0,105,add my spa appointment on the 12th to my calendar
0,43,are tomatoes on my shopping list
0,53,remind me to bring a jacket in tomorrow
0,24,tell me how traffic is looking on the interstate
0,113,"if i lost my luggage, where can i get help"
0,141,add the current song to my favorite playlist
0,147,i would like you to stop what you were doing
0,145,i am hungry and need a restaurant suggestion
0,145,help me pick a nice restaurant to dine at
0,130,"disconnect from my phone now, please"
0,105,remove meeting with carla from the calendar
0,68,please show me my recent transaction
0,130,connect with my phone please
0,65,please take feeding the fish off of my list of tasks to complete
0,65,you can remove vacuuming off the todo list
0,98,do i need to fill my tires
0,136,check me out on the map
0,118,move on to the next song
0,98,is the air pressure in my tires low
0,88,please reset your factory settings
0,61,"how do they say ""what's up"" in chinese"
0,86,how long does it take to cook roast beef
0,38,what is the exchange rate from pounds sterling to us dollars
0,133,send my money between accounts
0,63,buy delta ticket madison to atlanta
0,146,i've notified my bank that i'm in mexico from august 1 to august 5
0,119,"you are talking far too fast for me, can you slow it down a bit"
0,102,check the wait time for macaroni grill
0,16,i need you to order all the things on my shopping list
0,11,what's my name saved under
0,46,please suggest meals from italy to me
0,76,i want to hear everything on my reminder list
0,107,yes that is right
0,96,i am needing to know who made you
0,134,is it okay to substitute oregano for basil
0,82,how have you been doing
0,29,i need to switch the language for your responses
0,8,what type of gas am i allowed to put in this car
0,15,can you tell me some of your hobbies
0,13,can you please sat it one more time
0,0,how good are the ratings for outback
0,141,get happy on my rb playlist
0,31,how do you convert feet to inches
0,114,see you later!
0,1,where are the nutrition facts for cheerios
0,29,i am changing over to italian now
0,66,can you tell my what france's timezone is
0,46,what should i make for dinner
0,13,i want that repeated
0,8,is regular gas ok or does this car need something else
0,147,no more talking
0,142,how many mpg does this get on the highway
0,124,why thank you
0,94,how much did my state taxes change
0,8,which gas grade does this car take
0,84,can you tell me if my last amazon order is coming today
0,85,confirm my taco house reservation for jean
0,15,what sort of things do you enjoy
0,144,you can call me cindy
0,140,how long before the next day off is here
0,136,give me my current location
0,53,set a reminder to remind me to check when my car payment is
0,15,what kinds of things are you into
0,49,my card got declined at target while buying a tv
0,13,what was that last thing you said
0,119,please slow down i can't understand you
0,73,what is the spelling of potato
0,90,do you know when my card will come in
0,145,show me 5-star dining establishments in nashville
0,144,you can call me stevie
0,76,go through all the reminders on my list and state what they are
0,106,pull up my shower playlist
0,144,my name's bob
0,42,what city is the super bowl
0,47,is it time for new tires
0,5,what's today's weather going to be
0,50,how many reward points do i have available to redeem on my visa
0,76,let me know what's on my list of reminders
0,84,my order was put in and i was wonder how i can see the status of it
0,38,usd to yen is what right now
0,105,can you change the date of the doctor's appointment event in my calendar from april 1 to april 3rd
0,88,restore my factory settings immediately please
0,65,add cleaning to my to do list
0,84,what's the status of the order i placed online last week with target
0,134,could i use olive oil instead of grape seed oil
0,121,maybe
0,77,where would you say you were born
0,16,i need more candy so could you order me a pack
0,29,can i start talking to you in french
0,15,what hobbies do you enjoy in your free time
0,8,what kind of gas goes in this car
0,30,no that isn't the case
0,104,how do i make tuna salad
0,25,dial someone's phone number
0,70,discover card reporting fraud
0,0,does pizza hut have good reviews
0,99,"ai, how long have you been working"
0,123,do i need to change my oil
0,28,so how can i hurt my credit score
0,142,how much mpg do i have
0,55,i want to change your name to emma
0,85,can you verify my reservation under steve for friendly's
0,97,let's do a personal pto request for the dates may 12th to may 15th
0,102,can you tell me if there's a lot of wait time at wendy's around 8am
0,120,can i use the plug i use at home when traveling in south america
0,62,i want to know the carry on policy for aeromexico
0,26,send a message to natalie in the form of a text
0,69,what is my exact credit score
0,54,cut carrots can stay in the fridge for how long before going bad
0,17,tell me the tools i need to jump start my car
0,75,do you know your name
0,105,remove the may 11 event called baby shower from my calendar
0,112,what ingredients do i need to make potato skins
0,14,i want whisper mode
0,121,it's possible that it could be either
0,97,how do i schedule vacation days
0,70,i must report fraudulent activity on my debit
0,106,please play the new lady gaga song
0,23,schedule me a table for 2 at red lobster at 8
0,110,what is my current fuel level
0,8,what kind of gas does my car use
0,18,tell me how i can schedule a meeting
0,7,how are the interest rates at chase bank
0,17,how do i jump start the car
0,17,how do i properly give my car a jump
0,103,i haven't heard if my application for a credit card has been accepted or not can you check on it for me
0,115,what topics can i ask you about
0,149,what are some hot travel destinations
0,30,that's definitely false
0,16,i need everything on my shopping list
0,29,i want to switch speaking to french
0,112,what do you purchase to put in a shepherd's pie
0,96,what is the name of the person who created you
0,119,can you please slow down
0,95,tell me what day today is
0,77,would you care to let me know where you were made
0,112,what does subway use to make a cold cut combo
0,140,when is the next day i have off
0,66,in what timezone does baton rouge fall
0,8,which type of gas do i need to put in my car
0,42,what is saas marketing
0,43,whats on my list for shopping
0,29,speak in the language english
0,47,when should i go in and have my tires changed
0,146,how can i tell my bank i'm going to vietnam
0,95,what's today
0,63,let me know what flights there are out of dallas to miami on march 10 for under $450
0,38,exchange rate to go from dollar to yen
0,62,is there are limit of carry ons for my flight with aer lingus to cork
0,145,what are good restaurants in reno that serve sushi
0,63,what southwest flights are there for lax to sfo arriving april 1st and returning april 7th
0,75,is there a particular name i should call you
0,34,do you like cat or dogs
0,86,how long must i cook spaghetti for
0,66,what timezone is chicago in
0,37,look up the date of my car's most recent visit to the shop
0,107,that is not false
0,75,i would like to know your name
0,134,"i don't have sour cream, can i use yogurt instead"
0,21,what is playing
0,42,what year was star trek released
0,137,are there any transaction fees associated with my usaa card if i am in india
0,121,"hmmm, either could be a choice"
0,88,reset device to original settings
0,107,"yeah, that's right"
0,34,which animals do you have at home
0,1,can you give me information about the nutrition facts for celery
0,116,look up hotels with positive reviews in new york city
0,142,what is the gas mileage for the car that i drive
0,149,do you know of any activities in nashville
0,23,check reservation availability for 2 at red lobster at 8pm
0,21,which song is playing
0,117,are you a human
0,57,"when asked who you work for, what would you say"
0,13,i didn't catch that so please repeat it
0,135,how many calories does a scoop of chocolate ice cream contain
0,93,what amount do i make
0,124,thanks a lot for the answer
0,130,you must connect to my phone
0,129,i want to hear a fun fact about american presidents
0,43,i'd like to know what's on my shopping list
